{
  "artifacts": {
    "feature_catalog": {
      "path": "feature_catalog.json",
      "sha256": "6c3e024ac3cda6d98377693834c012e6a64161f8dc1d971d5f55de772e909a01"
    },
    "test": {
      "class_counts": {
        "0": 12,
        "1": 12
      },
      "cohort_ids": [
        "SYN_TEST_GAMMA"
      ],
      "path": "test.csv",
      "sample_count": 24,
      "sha256": "dd4d05af696ccf8e40c06ebdc8cac962d75a5435a21e39a61e4d1aa384df97e0"
    },
    "train": {
      "class_counts": {
        "0": 24,
        "1": 24
      },
      "cohort_ids": [
        "SYN_TRAIN_ALPHA",
        "SYN_TRAIN_BETA"
      ],
      "path": "train.csv",
      "sample_count": 48,
      "sha256": "2f2c2ce597ed15014a1972997c289881f05741fb7d7dfa0c55bdb578d1db8170"
    }
  },
  "constraints": {
    "cohort_id_disjoint": true,
    "declared_feature_vectors_disjoint": true,
    "sample_id_disjoint": true,
    "test_labels_excluded_from_model_fitting": true,
    "test_labels_excluded_from_scoring": true
  },
  "schema_version": "1.0.0",
  "split_id": "synthetic_statin_cold_split_v1",
  "status": "synthetic_only_not_clinically_validated",
  "target_column": "statin_exposure"
}
